{
  "schema": "specmetry.decision/v1",
  "target_id": "01J9Z3K5Q8R2T4V6W8X0Y2Z4B0",
  "snapshot": "8f3c2a1b9d7e6f5a4b3c2d1e0f9a8b7c6d5e4f3a",
  "criterion": "AC-003-1",
  "criterion_revision": 1,
  "requirement_revision": 1,
  "evidence_id": null,
  "seen_decision_id": null,
  "decision": "accepted",
  "mode": "exception",
  "acknowledged_risks": ["no_automated_evidence"],
  "rationale": "支付沙箱本周不可用，已与客户在预发布环境中人工完成支付流程验证"
}
